{"$schema":"https://json-schema.org/draft/2020-12/schema","title":"Filtered Zotero Snapshot","type":"object","required":["schema_version","snapshot_type","instance_id","exported_at","library","items"],"additionalProperties":false,"properties":{"schema_version":{"const":1},"snapshot_type":{"const":"zotero_filtered_metadata"},"instance_id":{"type":"string","pattern":"^[a-f0-9]{16,64}$","minLength":16},"exported_at":{"type":"string","minLength":1},"library":{"type":"object","required":["version"],"additionalProperties":false,"properties":{"version":{"oneOf":[{"type":"string","minLength":1},{"type":"integer"}]},"collection_key":{"type":"string","minLength":1,"pattern":"^[A-Za-z0-9]+$"}}},"items":{"type":"array","items":{"type":"object","required":["item_key","version","item_type","title","collections","tags","attachments"],"additionalProperties":false,"properties":{"item_key":{"type":"string","minLength":1},"version":{"type":"integer"},"item_type":{"type":"string","minLength":1},"title":{"type":"string","minLength":1},"doi":{"type":"string","minLength":1,"pattern":"^10\\.\\d{4,9}/\\S+$"},"collections":{"type":"array","items":{"type":"string","minLength":1}},"tags":{"type":"array","items":{"type":"string","minLength":1}},"attachments":{"type":"array","items":{"type":"object","required":["filename","content_type","item_key","version"],"additionalProperties":false,"properties":{"filename":{"type":"string","minLength":1},"content_type":{"type":"string","minLength":1},"item_key":{"type":"string","minLength":1},"version":{"type":"integer"}}}}}}}}}
