{"schema_version":1,"snapshot_type":"zotero_filtered_metadata","instance_id":"0123456789abcdef0123456789abcdef","exported_at":"2026-08-19T00:00:00+00:00","library":{"version":"7.0-synthetic","collection_key":"SYNTHCOLL1"},"items":[{"item_key":"SYNTH001","version":3,"item_type":"journalArticle","title":"Synthetic mine ventilation study","doi":"10.1000/synthetic-mine-ventilation","collections":["SYNTHCOLL1"],"tags":["synthetic","review"],"attachments":[{"filename":"synthetic-study.pdf","content_type":"application/pdf","item_key":"SYNTHATT1","version":2}]},{"item_key":"SYNTH002","version":1,"item_type":"report","title":"Synthetic lightweight aggregate report","collections":["SYNTHCOLL1"],"tags":["synthetic"],"attachments":[]}]}
